{
  "schema_version": "1.0",
  "finding_id": "find_run_20261018_second_company_nodata_none",
  "run_id": "run_20261018_second_company_nodata",
  "company": {
    "name": "Power Grid Corporation of India Limited",
    "aliases": [],
    "identity_status": "config_only"
  },
  "finding_status": "no_defensible_signal",
  "evidence_strength": "None",
  "headline": "No defensible signal can be produced from the available evidence.",
  "why_it_matters": "Required verified inputs are missing or incompatible, so the parent-versus-subsidiary renewable comparison cannot be computed.",
  "periods": [],
  "rank_score": 0.0,
  "rank_components": {},
  "inputs": [],
  "calculations": [],
  "supporting_evidence": [],
  "contradictory_evidence": [],
  "alternative_explanations": [],
  "falsification_conditions": [],
  "missing_evidence": [
    "verified inputs for all required roles"
  ],
  "limitations": [
    "Required verified inputs are missing or incompatible, so the parent-versus-subsidiary renewable comparison cannot be computed."
  ],
  "stage_provenance": [
    {
      "stage": "claims_load",
      "execution": "real",
      "detail": "0 claims loaded; all unverified"
    },
    {
      "stage": "evidence_bundle",
      "execution": "real",
      "detail": "0 claims / 0 chunks selected for F1/R1 (bounded)"
    },
    {
      "stage": "F1",
      "execution": "blocked",
      "detail": "SIGNALFORGE_API_KEY not configured; live F1 not attempted"
    },
    {
      "stage": "R1",
      "execution": "not_executed",
      "detail": "F1 not run"
    },
    {
      "stage": "source_retrieval",
      "execution": "not_executed",
      "detail": "no operator catalog and/or network not allowed; the adapter is implemented and fixture-tested only"
    },
    {
      "stage": "source_verification",
      "execution": "real",
      "detail": "0 assertions checked against the cited chunk text at level extracted_text_review (not primary-source); outcomes {}"
    },
    {
      "stage": "financial_signals",
      "execution": "real",
      "detail": "0 of 0 calculations computed (deterministic code)"
    },
    {
      "stage": "adjudication",
      "execution": "real",
      "detail": "status=no_defensible_signal strength=None (provisional rubric)"
    }
  ],
  "all_claims_unverified": true,
  "synthetic": false,
  "provisional_rubric": {
    "status": "PROVISIONAL - transparent initial weights, no calibration data"
  }
}
